{
  "$schema": "https://json-schema.org/draft/2020-12/schema",
  "$id": "https://abvx.invalid/schemas/content-fixture/v1",
  "title": "ABVX Content Fixture",
  "type": "object",
  "additionalProperties": false,
  "required": [
    "schema_version",
    "id",
    "project",
    "surface",
    "kind",
    "title",
    "slug",
    "summary",
    "locales",
    "adapter_id",
    "payload",
    "provenance"
  ],
  "properties": {
    "schema_version": { "const": "v1" },
    "id": { "type": "string", "minLength": 1 },
    "project": { "type": "string", "minLength": 1 },
    "surface": { "type": "string", "minLength": 1 },
    "kind": { "type": "string", "minLength": 1 },
    "title": { "type": "string", "minLength": 1 },
    "slug": { "type": "string", "minLength": 1 },
    "summary": { "type": "string", "minLength": 1 },
    "locales": {
      "type": "array",
      "minItems": 1,
      "items": { "type": "string", "minLength": 2 }
    },
    "adapter_id": { "type": "string", "minLength": 1 },
    "validation_flags": {
      "type": "object",
      "additionalProperties": { "type": "boolean" }
    },
    "payload": {
      "type": "object",
      "additionalProperties": false,
      "required": [
        "excerpt",
        "body_lines",
        "tags",
        "asset_refs",
        "source_refs",
        "media_event_candidate"
      ],
      "properties": {
        "source_markdown": { "type": "string", "minLength": 1 },
        "source_sha256": { "type": "string", "pattern": "^[a-f0-9]{64}$" },
        "media_assets": {
          "type": "array",
          "items": {
            "type": "object", "additionalProperties": false,
            "required": ["source", "target", "sha256"],
            "properties": {
              "source": { "type": "string", "minLength": 1 },
              "sha256": { "type": "string", "pattern": "^[a-f0-9]{64}$" },
              "target": { "type": "string", "pattern": "^/media/" }
            }
          }
        },
        "excerpt": { "type": "string", "minLength": 1 },
        "body_lines": {
          "type": "array",
          "minItems": 1,
          "items": { "type": "string", "minLength": 1 }
        },
        "tags": {
          "type": "array",
          "items": { "type": "string", "minLength": 1 }
        },
        "topics": {
          "type": "array",
          "items": { "type": "string", "minLength": 1 }
        },
        "asset_refs": {
          "type": "array",
          "items": { "type": "string", "minLength": 1 }
        },
        "source_refs": {
          "type": "array",
          "items": { "type": "string", "minLength": 1 }
        },
        "media_event_candidate": { "type": ["string", "null"] },
        "cover_image": { "type": ["string", "null"] },
        "image_alt": { "type": ["string", "null"] },
        "language": { "type": ["string", "null"] },
        "subtitle": { "type": ["string", "null"] },
        "date_published": { "type": ["string", "null"] },
        "seo_title": { "type": ["string", "null"] },
        "social_description": { "type": ["string", "null"] },
        "author": { "type": ["string", "null"] },
        "publisher": { "type": ["string", "null"] },
        "video_url": { "type": ["string", "null"] },
        "video_label": { "type": ["string", "null"] },
        "video_after_paragraph": { "type": ["integer", "null"], "minimum": 1 },
        "external_links": {
          "type": "array",
          "items": {
            "type": "object",
            "additionalProperties": false,
            "required": ["label", "href"],
            "properties": {
              "label": { "type": "string", "minLength": 1 },
              "href": { "type": "string", "minLength": 1 }
            }
          }
        },
        "entities": {
          "type": "array",
          "items": { "type": "string", "minLength": 1 }
        },
        "related_projects": {
          "type": "array",
          "items": { "type": "string", "minLength": 1 }
        },
        "internal_link_candidates": {
          "type": "array",
          "items": { "type": "string", "minLength": 1 }
        },
        "context_request_ref": { "type": ["string", "null"] }
      }
    },
    "provenance": {
      "type": "object",
      "additionalProperties": false,
      "required": ["recorded_by", "source_uri", "observed_at"],
      "properties": {
        "recorded_by": { "type": "string", "minLength": 1 },
        "source_uri": { "type": ["string", "null"] },
        "observed_at": { "type": "string", "format": "date-time" }
      }
    }
  }
}
