{
  "schema_version": "v1",
  "id": "content-publish-001-ssi-headlands",
  "project": "ssi",
  "surface": "short-post",
  "kind": "post",
  "title": "The Headlands: A Ukrainian Farming Game Where Every Harvest Has a Price",
  "slug": "from-ukrainian-grain-markets-to-a-ukrainian-farming-game",
  "summary": "SSI editorial post about The Headlands as a cultural counterpart to Ukrainian agricultural market signals.",
  "locales": ["en"],
  "adapter_id": "ssi.short-post",
  "payload": {
    "excerpt": "A new indie strategy game turns the everyday realities of running a small Ukrainian farm — machinery, fuel, weather and grain prices — into a calm, distinctly local experience.",
    "body_lines": [
      "At SPIKE SPOT INDEX, we usually approach Ukrainian agriculture through market signals: grain prices, logistics, supply and demand. The Headlands offers a different perspective — one rooted in the everyday decisions behind those numbers.",
      "Created by Ukrainian indie developer Vladyslav, known as TessaraOxygen, The Headlands is a meditative top-down farming strategy set in a Ukrainian village at the turn of the 2000s. Its setting sits between two eras: the familiar legacy of Soviet-built machinery and the uncertain, resourceful reality of an independent countryside finding its own way forward.",
      "The player takes over a neglected farm with little more than an ageing tractor, a few fields and limited resources. From there, progress is deliberately gradual: cultivate land, sow grain, harvest crops, manage fuel consumption and decide when — and whether — to sell into a changing market.",
      "That market element makes the game especially resonant for anyone familiar with agriculture. Grain prices are not simply a background number: they influence planning, investment and the timing of every sale. A good harvest does not automatically mean a good result; machinery, fuel, time and market conditions must all be balanced.",
      "Weather is another central part of farm management. Rather than functioning as decoration, it directly affects day-to-day work and reinforces the game’s unhurried rhythm: observe conditions, plan carefully and allow the farm to grow step by step.",
      "The Headlands also places unusual emphasis on the character of agricultural machinery. Its tractors, trucks and harvesters are designed around the sounds, wear and practical details that many people from the region will recognise. Players can expand their fleet with specialised equipment, help local residents through contracts, and work alongside a mechanic-mentor who creates one-of-a-kind homemade machines outside any official catalogue.",
      "The result is not a high-pressure farming simulator, but a thoughtful game about work, patience and the practical choices that shape rural life. It is a cultural counterpart to the agricultural market data we analyse every day: a reminder that behind every tonne of grain is land, machinery, weather, people and a sequence of decisions.",
      "The Headlands is scheduled for release on 14 September 2026. A free demo is already available on Steam. The Steam page describes it as a single-player, top-down farming strategy focused on gradual farm growth, resource management, contracts and a living grain market."
    ],
    "tags": ["Ukraine", "grain market", "farming", "games", "SPIKE Spot Index"],
    "topics": ["Ukraine", "grain market", "cultural context", "farming game"],
    "asset_refs": [
      "/blog/the-headlands-ukrainian-farming-game-context.jpg"
    ],
    "source_refs": [
      "https://dev.ua/news/the-headlands-1784625711",
      "https://store.steampowered.com/app/4301110/The_Headlands/",
      "https://youtu.be/66bVMxlkREc"
    ],
    "media_event_candidate": null,
    "author": "Anton BV",
    "publisher": "SPIKE Spot Index",
    "cover_image": "/blog/the-headlands-ukrainian-farming-game-context.jpg",
    "image_alt": "The Headlands header image",
    "language": "en",
    "subtitle": "A new indie strategy game turns the everyday realities of running a small Ukrainian farm — machinery, fuel, weather and grain prices — into a calm, distinctly local experience.",
    "seo_title": "The Headlands: A Ukrainian Farming Game Where Every Harvest Has a Price",
    "video_url": "https://youtu.be/66bVMxlkREc?si=uIewZqricSiuFjAD",
    "video_label": "Watch the trailer",
    "video_after_paragraph": 3,
    "external_links": [
      {
        "label": "Steam",
        "href": "https://store.steampowered.com/app/4301110/The_Headlands/"
      },
      {
        "label": "Trailer",
        "href": "https://youtu.be/66bVMxlkREc?si=uIewZqricSiuFjAD"
      }
    ],
    "entities": [
      "The Headlands",
      "Vladyslav",
      "TessaraOxygen",
      "Ukraine",
      "SPIKE Spot Index",
      "Steam"
    ],
    "internal_link_candidates": [
      "/en/blog/why-ukraine-needs-daily-spot-commodity-index",
      "/en/blog/how-spot-indices-help-read-daily-grain-market-movement"
    ]
  },
  "provenance": {
    "recorded_by": "CONTENT-PUBLISH-001",
    "source_uri": "https://dev.ua/news/the-headlands-1784625711",
    "observed_at": "2026-08-10T00:00:00Z"
  }
}
