{
  "schema_version": "v1",
  "id": "content-publish-006-abvx-two-new-books",
  "project": "abvxsite",
  "surface": "writing",
  "kind": "note",
  "title": "Two New Books",
  "slug": "two-new-books",
  "summary": "A short note about two very different books published within a few days: one psychological and fragmentary, the other about strange economic indicators and the limits of proxies.",
  "locales": [
    "en"
  ],
  "adapter_id": "abvx.writing",
  "payload": {
    "excerpt": "A short note about two very different books published within a few days: one psychological and fragmentary, the other about strange economic indicators and the limits of proxies.",
    "body_lines": [
      "I somehow ended up publishing two books within a few days. They could hardly be more different, which is probably why I enjoy seeing them next to each other.",
      "## Fragments from a Therapist’s Notebook",
      "[Fragments from a Therapist’s Notebook](https://abvx.xyz/books/fragments-from-a-therapists-notebook) is the more personal of the two. It is built from short psychological observations rather than one continuous argument, and it moves through trauma, identity, relationships, anxiety, and the ways people explain themselves to themselves.",
      "Links: [ABVX book page](https://abvx.xyz/books/fragments-from-a-therapists-notebook), [Kindle](https://www.amazon.com/dp/B0HF38FS2X), [Paperback](https://www.amazon.com/dp/B0HCVPYC5D).",
      "## Burgers, Lipstick & Underwear",
      "[Burgers, Lipstick & Underwear](https://abvx.xyz/books/burgers-lipstick-underwear) sits much closer to business and economics, but I wrote it as curious popular nonfiction rather than a technical book. It looks at the strange proxies people use to make large systems legible — burgers, lipstick, underwear, working time, freight, pollution equivalents, benchmarks — and asks when an indicator really reveals something and when it turns into folklore, oversimplification, or something people learn to game.",
      "Links: [ABVX book page](https://abvx.xyz/books/burgers-lipstick-underwear), [Kindle](https://www.amazon.com/dp/B0HF5DWCHB), [Paperback](https://www.amazon.com/dp/B0HF7SJJ7N).",
      "One book comes out of psychology and observation. The other comes out of markets, business, and measurement. They sit at opposite ends of my interests, which is exactly why I wanted both of them to exist."
    ],
    "cover_image": null,
    "image_alt": null,
    "asset_refs": [],
    "source_refs": [
      "owner:approved-prompt",
      "https://abvx.xyz/books/fragments-from-a-therapists-notebook",
      "https://abvx.xyz/books/burgers-lipstick-underwear"
    ],
    "media_event_candidate": null,
    "tags": [
      "books",
      "psychology",
      "economics"
    ],
    "topics": [
      "personal writing",
      "book publication",
      "psychology and economics"
    ],
    "language": "English",
    "date_published": "2026-08-14",
    "seo_title": "Two New Books",
    "social_description": "A short note about two very different books published within a few days: one psychological and fragmentary, the other about strange economic indicators and the limits of proxies.",
    "author": "Anton BV",
    "publisher": "ABVX",
    "related_projects": [
      "books",
      "writing",
      "about"
    ],
    "internal_link_candidates": [
      "/writing",
      "/books",
      "/about"
    ],
    "entities": [
      "Anton Biletskyi-Volokh",
      "ABVX",
      "Fragments from a Therapist’s Notebook",
      "Burgers, Lipstick & Underwear"
    ]
  },
  "provenance": {
    "recorded_by": "ABVX-PUBLISH-BOOKS-NOTE-001",
    "source_uri": null,
    "observed_at": "2026-08-14T00:00:00Z"
  }
}
